name	surname	email	age	location	country_code
Трофим                 	Абалихин        	            trofim1987@yandex.ru	25.09.87	Россия, г. Иваново, Гагарина ул., д. 21 кв.146	RUS
Егор	Васенин	egor89@rambler.ru	10.01.1980		RUS
Евгений	Анохин	evgeniy.anohin@gmail.com	27.05.1963	Россия, г. Ковров, Комсомольская ул., д. 1 кв.103	AFG
Петр	Мосяков	petr09021968@::gmail.com	09.02.1968	Россия, г. Великий Новгород, Радужная ул., д. 6 кв.50	DZA
Кирилл	Яманов	kirill.yamanov@ya.ru	27.10.1969	Россия, г. Пушкино, Новоселов ул., д. 23 кв.62	AN3
